PRVDR_CTGRY_SBTYP_CD,PRVDR_CTGRY_CD,CHOW_CNT,CHOW_DT,CITY_NAME,FAC_NAME,STATE_CD,SSA_STATE_CD,STATE_RGN_CD,ST_ADR,ZIP_CD,FIPS_STATE_CD,FIPS_CNTY_CD,MLT_FAC_ORG_NAME,PRVDR_NUM
01,15,0,"","FERNANDEZ JUNCOS","AFSC OF SAN JUAN",PR,40,001,"1413 FERNANDEZ JUNCOS AVE SUITE 1A",909,72,127,"",40C0001033
01,15,0,"","JUANA DIAZ","FRESENIUS VASCULAR CARE DEL CARIBE INC",PR,40,001,"PARQUE INDUSTRIAL AMUELAS CARR 584 KM 4",795,72,075,"",40C0001034
01,15,0,"",HUMACAO,"RYDER MEMORIAL ASC",PR,40,001,"PO BOX 489 FONT MARTELOST",792,72,069,"",40C0001100
01,15,0,"",ARROYO,"LAFAYETTE HOSP ASC",PR,40,001,"PO BOX 207",714,72,015,"",40C0001101
01,15,0,"",PONCE,"INSTITUTO QUIRURGICO DR PILA",PR,40,001,"AVE LAS AMERICAS",733,72,113,"",40C0001102
01,15,1,19870624,SANTURCE,"DOCTORS ONE DAY SURGERY CENTER",PR,40,001,"PO BOX 11338",910,72,127,"",40C0001103
01,15,1,"",BAYAMON,"HERMANOS MELENDEZ HOSPITAL ASC",PR,40,001,"CARR NO 2  KM 11 7",956,72,021,"",40C0001104
01,15,0,"","HATO REY","HATO REY COMMUNITY HOSP ASC",PR,40,001,"435 PONCE DE LEON AVE",919,72,127,"",40C0001106
01,15,0,"",MAYAGUEZ,"LA ESPANOLA CLINIC ASC",PR,40,001,"BARRIO LA QUINTA BOX 840",680,72,097,"",40C0001107
01,15,0,"","SAN JUAN","CENTRO DE CIRUGIA PARA MANEJO DE DOLOR",PR,40,001,"TORRE SAN FRANCISCO, DE DIEGO 369",923,72,127,"",40C0001108
01,17,0,"","HATO REY","PUERTO RICO ORGAN PROCUREMENT AGENCY",PR,40,001,"AUXILIO MUTUO HOSPITAL BOX 1227",919,72,127,"",40P001
01,17,0,"",GUAYNABO,"LIFE LINK OF PUERTO RICO",PR,40,001,"DAIMLER-CHRYSLER BLDG, SUITE 100, CALLE 1, #1",968,72,127,"",40P002
01,07,0,"","SAN SEBASTIAN","AMB SURGICAL SERVICES PORTABLE X RAYS",PR,40,001,"#3 JOSE MENDEZ ST BOX 486",755,"","","",40X0009800
01,07,0,"","TRUJILLO ALTO","HOME IMAGES PSC",PR,40,001,"AVENIDA BORINQUEN NUMERO 110 SUITE 3-2",976,72,139,"",40X0009801
01,12,0,"",CLEVELAND,"CLEVELAND MED CLINIC FAMILY PR",TX,45,TX6,"208 NORTH BONHAM AVE",77327,48,291,"",453967
01,19,0,"",WOODBRIDGE,"CTRS AMERICAN DAY TRTMNT PR WM CNTY",VA,49,001,"2200 OPITZ BLVD SUITE 100",22191,51,153,"",494604
