PRVDR_CTGRY_SBTYP_CD,PRVDR_CTGRY_CD,CHOW_CNT,CHOW_DT,CITY_NAME,FAC_NAME,STATE_CD,SSA_STATE_CD,STATE_RGN_CD,ST_ADR,ZIP_CD,FIPS_STATE_CD,FIPS_CNTY_CD,MLT_FAC_ORG_NAME,PRVDR_NUM
01,09,1,19970815,PONCE,"ESRD HOSPITAL DR PILA",PR,40,001,"LAS AMERICAS AVENUE",731,72,113,"",402315
01,09,1,"","HATO REY","BMA OF SAN JUAN",PR,40,001,"ANTILLAS WAREHOUSE AND OFFICE PARK 461",917,72,127,"FRESENIUS MEDICAL CARE HOLDING INC",402501
01,09,1,"",PONCE,"BMA PONCE INC",PR,40,001,"SAN JORGE PROFESSIONAL BLDG 610 CALLE DAMAS",731,72,113,"FRESENIUS MEDICAL CARE HOLDING INC",402502
01,09,1,19811023,MAYAGUEZ,"BMA OF MAYAGUEZ",PR,40,001,"1050 LOS CORAZONES AVENUE SUITE 101",680,72,097,"FRESENIUS MEDICAL CARE HOLDING INC",402503
01,09,0,"",BAYAMON,"BMA OF BAYAMON",PR,40,001,"ROAD 2 KM 11  2   FRANCISCO RODRIGUEZ TORRES BLDG",960,72,021,"FRESENIUS MEDICAL CARE HOLDING INC 920",402504
01,09,1,"",CAGUAS,"BMA OF CAGUAS",PR,40,001,"CARR 1 KM 34 6 CAGUITAS MALL",725,72,025,"FRESENIUS MEDICAL CARE HOLDINGS INC",402505
01,09,0,"","SAN GERMAN","BMA OF SAN GERMAN",PR,40,001,"CARR 2 KM 173 4 BO CAIN ALTO",683,72,125,"",402506
01,09,0,"",CAROLINA,"BIO MEDICAL APPLICATION OF CAROLINA INC",PR,40,001,"GOLDEN TOWER CONDOMINIUM C 8 PONTEZUELA AVE",983,72,031,"FRESENIUS MEDICAL CARE HOLDING, INC",402507
01,09,3,"",ARECIBO,"BIO MEDICAL APPLICATIONS OF ARECIBO INC",PR,40,001,"MIRAMAR AVE 1072 CARR NO 2 KM 78 5",612,72,013,"FRESENIOUS MEDICAL CARE HOLDINGS INC",402508
01,09,1,"",GUAYAMA,"FRESENIUS MEDICAL CARE GUAYAMA DIALYSIS",PR,40,001,"900 CALLE ARNALDO BRISTOL",784,72,057,"FRESENIUS MEDICAL CARE NORTH AMERICA",402509
01,09,1,"",PONCE,"THE RENAL CENTRE OF PONCE",PR,40,001,"BO MACHUELO CARR 14  HOSP SAN LUCAS II",731,72,113,"ATLANTIS HEALTH GROUP  PUERTO RICO",402510
01,09,0,"",FAJARDO,"FAJARDO RENAL CENTER, HEMO CARE INC",PR,40,001,"FAJARDO SHOPPING CTR KM  45 STORE #2",738,72,053,"",402511
01,09,0,"","HATO REY","BMA LAS AMERICAS",PR,40,001,"400 ROOSEVELT AVE SUITE 108",918,72,127,"",402512
01,09,1,"",AGUADILLA,"BMA AGUADILLA",PR,40,001,"ROAD 459 KMO 7 BO CAMASEYES",603,72,005,"FRESENIUS MEDICAL CARE HOLDINGS, INC",402513
01,09,0,"",HUMACAO,"BMA OF HUMACAO INC",PR,40,001,"RD 3 KM 73-8 PLAZA BOULEVARD SHOPPING CENTER",791,72,069,"FRESENIUS MEDICAL CARE",402514
01,09,0,"","RIO PIEDRAS","FRESENIUS MEDICAL CARE RIO PIEDRAS",PR,40,001,"1535  PONCE DE LEON AVENUE  EL CINCO WARD",926,72,127,"FRESENIUS MEDICAL CARE HOLDING INC",402515
01,09,0,"",AIBONITO,"UNIDAD DIALISIS DE AIBONITO",PR,40,001,"CARRETERA ESTATAL NO 726",705,72,009,"",402516
01,09,0,"",PONCE,"BIO MEDICAL APPLICATIONS OF WEST PONCE,INC DBA BMA",PR,40,001,"#500 URB PUNTO DE ORO AVE EXTERIOR",731,72,113,"FRESENIUS MEDICAL CARE HOLDING INC",402517
01,09,3,19990401,"VEGA BAJA","VEGA BAJA RENAL DIALYSIS CENTER",PR,40,001,"3995 ROAD 2",693,72,145,"FRESENIUS MEDICAL CARE HOLDING INC",402518
01,09,1,20030403,AGUADILLA,"THE RENAL CENTRE OF AGUADILLA",PR,40,001,"WESTERN MEDICAL PLAZA AVE SEVERIANO CUEVAS 18",603,72,005,"ATLANTIS HEALTHCARE GROUP OF PR INC",402519
01,09,0,"",BAYAMON,"CENTRO RENAL DE BAYAMON",PR,40,001,"CALLE ESPANA (30) ESQUINA CALLE 41",956,72,021,"",402520
01,09,1,20010424,FAJARDO,"THE RENAL CENTRE OF FAJARDO",PR,40,001,"TORRES DE SAN PABLO DEL ESTE",738,72,053,"ATLANTIS HEALTH CARE GROUP PR INC",402521
01,09,1,20020601,"SAN JUAN","AUXILIO MUTUO DIALYSIS CENTER",PR,40,001,"PO BOX 364663",936,72,127,"TOTAL RENAL CARE, INC",402522
01,09,1,20020326,PONCE,"DR PILA DIALYSIS CENTER",PR,40,001,"PO BOX 9050",732,72,113,"TOTAL RENAL CARE INC",402523
01,09,0,"",YAUCO,"YAUCO DIALYSIS CENTER",PR,40,001,"COND TORRES NAVEL  OFIC 102C",698,72,153,"TOTAL RENAL CARE",402524
01,09,0,"",MAYAGUEZ,"FMC DIALYSIS SERVICES OF NORTH MAYAGUEZ RENAL CENT",PR,40,001,"ROAD 64, BO SABANETAS, PO BOX 3516 MARINA STATION",681,72,097,"FRESENIUS MEDICAL CARE HOLDINGS INC",402525
01,09,0,"","EXT LOS ROBLES","CENTRO RENAL DE AGUADA",PR,40,001,"CALLE COLON 106",602,72,003,"",402526
01,09,3,"",MAYAGUEZ,"THE RENAL CENTRE OF MAYAGUEZ",PR,40,001,"PISO 1 EDIFICIO OFFICE PARK IV CARR 2 KM 156",680,72,097,"ATLANTIS HELTHCARE GROUP OF PR",402527
01,09,0,"",PONCE,"FRESENIUS MEDICAL CARE PONCE CENTRO DIALYSIS",PR,40,001,"7309 CALLE RAMON POWER",717,72,113,"FRESINUIS MEDICAL CARE HOLDINGS INC",402528
01,09,0,"",ARECIBO,"BIO MEDICAL APPLICATION OF PUERTO RICO INC",PR,40,001,"CARR 129 AVENUESAN LUIS HOSPITAL CAYETANO COLL Y",612,72,013,"FRESENIUS MEDICAL CARE HOLDING",402529
01,09,0,"","SAN JUAN","LOS PASEO PASEOS DIALYSIS CENTER",PR,40,001,"LAS CUMBRE AVE SR 199 KM3 BO CUPEY",926,72,127,"FRESENIUS MEDICAL CARE HOLDING INC",402530
01,09,0,"",YAUCO,"CENTRO RENAL DE YAUCO",PR,40,001,"CALLE PROLONGACION 25 DE JULIO, OFFICE 102C",698,72,153,"FRESENIUS MEDICAL CARE HOLDING INC",402531
01,09,0,"",ARECIBO,"FMC DIALYSIS SERVICES DEL NORT",PR,40,001,"CARR 129, SAN LUIS AVENUE, SUITE 108",612,72,013,"ATLANTIS HEALTH CARE OF PUERTO RICO",402532
01,09,0,"","ALT DE LUCHETTI","THE RENAL CENTRE OF MANATI",PR,40,001,"ROAD 2 KM 47 7 SECTOR COTTO SUR",674,72,091,"ATLANTIS HEALTHCARE GROUP OF PR INC",402533
01,09,0,"",GUAYNABO,"THE RENAL CENTRE OF GUAYNABO",PR,40,001,"LAS CUMBRE AVE 140 GUAYNABO MEDICAL MALL SUITE 107",970,72,061,"ATLANTIS HEALTHCARE GROUP OF PR INC PO",402534
01,09,0,"",LARES,"THE RENAL CENTRE OF LARES",PR,40,001,"ROUTE 129 KM 25 6 BO PILETAS CASTRO BOROUGH",669,72,081,"ATLANTIS HEALTHCARE GROUP P R INC",402535
01,09,0,"","SAN SEBASTIAN","THE RENAL CENTRE OF SAN SEBASTIAN",PR,40,001,"PAVIA FERNADEZ #120",685,72,131,"ATLANTIS HEALTHCARE GROUP PR INC",402536
01,09,0,"",ISABELA,"THE RENAL CENTRE OF ISABELA",PR,40,001,"7227 AVE AGUSTIN RAMOS",662,72,071,"ATLANTIS HEALTHCARE GROUP OF PR, INC",402537
01,09,0,"","ALT DE LA FUENTE","THE  RENAL CENTRE OF CAGUAS",PR,40,001,"AVE LUIS MUNOZ MARIN ESQUINA GEORGETTY",725,72,025,"ATLANTIS HEALTH CARE GROUP PR INC",402538
01,09,0,"","ALTS DE COVADONGA","THE RENAL CENTRE OF TOA BAJA",PR,40,001,"CARR 167 AVENUE COMERIO NORTH 600",949,72,137,ATLANTIS,402539
01,09,0,"",CANOVANAS,"FRESENIUS MEDICAL CARE CANOVANAS",PR,40,001,"EAST PROFESSIONAL MEDICAL CENTER STATE ROAD 3",729,72,029,"FRESENIUS MEDICAL CARE HOLDINGS INC",402540
01,09,3,"","ALT DE PARQ ECUESTRE","THE RENAL CENTRE OF CAROLINA",PR,40,001,"PASEO DEL PRADO SHOPPING CENTER CARR PR 3 KM 8 HM4",987,72,031,"",402541
01,09,0,"","URB SANTA JUANITA","FRESENIUS MEDICAL CARE SANTA JUANITA DIALYSIS",PR,40,001,"URB SANTA JUANITA CALLE 30  ESQUINA CALLE41 #200",956,72,021,"FRESENIUS MEDICAL CARE",402543
01,09,0,"",VIEQUES,"FRESENIUS MED CARE VIEQUES DIALYSIS",PR,40,001,"BARRIO DESTINO CARR 997 KM 0 HM 1",765,72,147,"FRESENIUS MEDICAL CARE HOLDINGS INC",402544
01,09,0,"","ALT DE LA FUENTE","CAGUAS DIALYSIS AND NEPHROLOGY CENTER",PR,40,001,"HOSPITAL SAN JUAN BAUTISTA 3RD FLOOR",725,72,025,"",402545
01,09,1,"",NARANJITO,"SNG-NARANJITO, LLC",PR,40,001,"ROAD 164 KM 6  9",719,72,105,"SNG RENAL PHYSICIANS OF NORTH TEXAS",402546
01,09,0,"","BDA FLORES","THE RENAL CENTRE OF JUNCOS",PR,40,001,"BO CEIBA NORTE CARR 3 KM 24 JUNCOS PLAZA SHOPPING",777,72,077,"ATLANTIS HEALTH CARE GROUP PR INC",402547
01,09,0,"",DORADO,"THE RENAL CENTRE OF DORADO",PR,40,001,"PASEO DEL PLATA SHOPPING VILLAGE AVE JOSE EFRON ES",646,72,051,"ATLANTIS HEALTHCARE GROUP",402548
01,09,0,"",CAYEY,"FRESENIUS MEDICAL CARE CAYEY DIALYSIS",PR,40,001,"CALLE 1 LOTE 1  HOSPITAL MENONITA CAYEY CARR 14 KM",736,72,035,"FRESENIUS MED CARE HOLDINGS",402549
01,09,0,"","VEGA ALTA","FRESENIUS MEDICAL CARE VEGA ALTA DIALYSIS",PR,40,001,"CALLE 1 LOTE 2 ESPINOSA WARD PARQUE INDUCTRIAL DE",692,72,143,"FRESENIUS MEDICAL CARE HOLDING INC",402550
01,09,0,"","RIO GRANDE","FRESENIUS MEDICAL CARE RIO GRANDE DIALYSIS",PR,40,001,"LAS FLORES INDUSTRIAL PARK, LOT 6 CARR 3KM 23  9",721,72,119,"FRESENIUS MEDICAL CARE HOLDING, INC",402551
01,09,0,"","SAN GERMAN","THE RENAL CENTRE OF SAN GERMAN",PR,40,001,"CENTRO COMERCIAL LAS LOMAS AVE CASTRO PEREZ",683,72,125,"ATLANTIS HEALTHCARE GROUP  PR INC",402552
01,09,0,"","LAS PIEDRAS","FRESENIUS MEDICAL CARE LAS PIEDRAS",PR,40,001,"200 PLAZA LAS PIEDRAS SHOPPING CENTER ROAD 183",771,72,085,"FRESENIUS MEDICAL CARE HOLDING INC",402553
01,09,0,"","JUANA DIAZ","FRESENIUS MEDICAL CARE OF JUANA DIAZ",PR,40,001,"CARR 584 KM 0 4",795,72,075,"FRESENIUS MEDICAL CARE DIALYSIS SERVIC",402554
05,01,0,"","SAN JUAN","HEALTH SOUTH REHABILITATION HOSPITAL OF SAN JUAN",PR,40,001,"UNIVERSITY DISTRICT HOSPITAL -- 3RD  FLOOR",936,72,127,"",403025
05,01,0,"","ALTS DE MANATI","HEALTHSOUTH REHABILITATION HOSPITAL OF MANATI, INC",PR,40,001,"CARR 2 K47 7",674,72,091,"",403026
05,01,0,"","SAN JUAN","MULTY MEDICAL FACILITIES CORPORATION",PR,40,001,"MUNOZ RIVERA AVENUE 402",918,72,127,"",403027
06,01,0,"","SAN JUAN","UNIVERSITY PEDIATRIC HOSPITAL",PR,40,001,"PUERTO RICO MEDICAL CENTER IN RIO PIEDRAS",935,72,127,"",403301
04,01,0,"",BAYAMON,"MEPSI CENTER",PR,40,001,"RD NUM 2 KM 8 2",956,72,021,"",404002
04,01,2,"",CIDRA,"FIRST HOSPITAL PANAMERICANO",PR,40,001,"STATE ROAD 787 KM 1  5",739,72,041,"",404004
04,01,0,"","RIO PIEDRAS","SAN JUAN CAPESTRANO PSYCIATRIC HOSPITAL",PR,40,001,"CARR 877 KM 1 6 CAMINO LAS LOMAS RR2",928,72,127,"",404005
04,01,0,"",CAPARRA,"HOSPITAL PSIQUIATRIA DR RAMON FERNANDEZ",PR,40,001,"CALLE MAGA BO MONACILLOS",922,72,127,"",404006
04,01,0,"","BO BALLAJA","HOSPITAL PSIQUIATRICO METROPOLITANO CABO ROJO",PR,40,001,"108 MUNOZ RIVERA STREET",623,72,023,"",404007
04,01,0,"",PONCE,"INSPIRA BEHAVIOR CARE CORP",PR,40,001,"CALLE GUADALUPE 184 (ANTIGUO HOSPITAL SAN LUCAS)",733,72,113,"",404008
04,01,0,"",AIBONITO,"CENTRO DE SALUD CONDUCTUAL MENONITA-CIMA",PR,40,001,"CARR ESTATAL 14 INTERIOR SARGENTO GERARDO SANTIAGO",705,72,009,"",404009
01,14,0,"",HUMACAO,"OASIS REHABILITATION SERVICES, INC",PR,40,001,"URB JARDINES DE HUNACAO, EDIFICIO PLAZA 2000",792,72,069,"",404500
01,14,0,"","SAN JUAN","UNIVERSAL THERAPY CENTER INC",PR,40,001,"1610 AVE PONCE DE LEON EDIFICIO SANTA ANA",907,72,127,"",404501
01,14,0,"",BAYAMON,"ISLAND REHABILITATION CENTER",PR,40,001,"CALLE 28 SANTA CRUZ",961,72,021,"",404502
01,14,0,"",SANTURCE,"METROPOLITAN WOUND CARE AND REHABILITATION CENTER",PR,40,001,"150 DE DIEGO AVE SUITE 201 SAN JUAN HEALTH CENTRE",907,72,127,"",404503
01,14,0,"","ALT DE LA FUENTE","THERAMAX INC",PR,40,001,"35 RUIZ BELVIS ST",725,72,025,"",404504
01,14,0,"","ALT DE LUCHETTI","CLINICA DE TERAPIA FISICA Y REHABILITACION DEL NOR",PR,40,001,"LAS VEGAS BLDG 420 RD 2 KM 46BO CAMPO ALEGRE",674,72,091,"",404505
01,19,0,"","RIO PIEDRAS","PSYCH CTR FOR MENTAL HEALTH SE",PR,40,001,"ROAD 849  KM 1 9  URB SAN MARTIN",924,72,127,"",404601
01,19,0,"","HATO REY","INSTITUTO PSICOTERAPEUTIC DE PR INC",PR,40,001,"431 DE HOSTOS AVENUE",918,72,127,"",404602
01,19,0,"",CANOVANAS,"CENTRO ORIENTACION AYUDA PSIQUIATRICA",PR,40,001,"LOIZA VALLEY SHOPPING CENTER LOCAL AA",729,72,029,"",404603
01,19,0,"",CAROLINA,"PROVIDENCIA MENTAL HEALTH CENT",PR,40,001,"ROAD 858 KM 36 BARRIO CACAO",985,72,031,"",404604
01,19,0,"",HUMACAO,"NEUROPSYCHODYNAMIC INSTITUTE",PR,40,001,"BOX 8887",792,72,069,"",404605
01,19,0,"",GUAYAMA,"NEUROPSYCHODYNAMIC INSTITUTE",PR,40,001,"ROAD#3 KM 142 SECTOR MELANIA",785,72,057,"",404606
01,19,0,"","SAN JUAN","VICTORIA BEHAVIORAL HEALTH CENTER",PR,40,001,"804 CONDADO STREET",908,72,127,"",404607
01,19,0,"",MANATI,"INTEGRATED HEALTH CARE SYSTEMS",PR,40,001,"ROAD 149, KM 7 5 BO RIO ARRIBA SALIA",674,72,091,"",404608
01,19,0,"",CAROLINA,"SAN GABRIEL CMHC",PR,40,001,"CARR 860 KM 3 BO MARTIN GONZALEZ",985,72,031,"",404609
01,19,0,"",CAGUAS,"INSTITUTO PARA EL DESARROLLO P",PR,40,001,"202 GAUTIER BENITEZ STREET SUITE 021",725,72,025,"",404610
01,19,0,"","RIO GRANDE","RIO GRANDE COMM MENTAL HEALTH",PR,40,001,"40 SOLEDAD STREET",745,72,119,"",404611
01,19,0,"","LAS PIEDRAS","NOR COMMUNITY MENTAL HEALTH",PR,40,001,"253 BARBOSA AVENUE",771,72,085,"",404612
01,19,0,"",CIDRA,"CIDRA COMMUNITY MENTAL HEALTH",PR,40,001,"CARR 7733 KM 1 8 BO  SUD",739,72,041,"",404613
01,19,0,"",BAYAMON,"NEW DAYS COMMUNITY MENTAL HEAL",PR,40,001,"CALLE 2 -G14,  URBANIZACION VILLA RICA",959,72,021,"",404614
01,19,0,"","BDA NICOLIN PEREZ","CLINICA PARA EL CUIDADO Y TRATAMIENTO DE LA CONDUC",PR,40,001,"SERVICIOS MEDICOS DEL VALLE DE LAJAS, AVE FLAMBAYA",667,72,079,"",404615
01,19,0,"","BDA BITUMUL","INSTITUTO PSICO DE PR - AUXILIO MUTUO",PR,40,001,"COND DE LA TORRE AUXILIO MUTUO AVE PONCE DE LEON",917,72,127,"",404616
01,19,0,"","ALT DE LA FUENTE","INSTITUTO PSICO DE PR - CAGUAS",PR,40,001,"CONSOLIDATED MALL LOCAL B-5",725,72,025,"",404617
01,19,0,"",BAYAMON,"INSTITUTO PSICO DE PUERTO RICO - BAYAMON",PR,40,001,"EFFICIO CENTURION PISO 3, CARRETERA 2, KILO 11 8",961,72,021,"",404618
01,04,0,"",HUMACAO,"RYDER MEMORIAL HOSPITAL INC",PR,40,001,"355 AVE  FONT MARTELO",792,72,069,"",405018
01,04,0,"",CAGUAS,"CAGUAS SUB REGIONAL SNF",PR,40,001,"BOX 1238",625,"","","",405019
01,04,0,"",BAYAMON,"DR RAMON RUIZ ARNAU HOSP",PR,40,001,"LAUREL AVE SANTA JUANITA",619,"","","",405020
01,04,0,"","RIO PIEDRAS","SAN JUAN AGING CENTER",PR,40,001,"65 INF AVE K3 H4",924,72,127,"",405021
01,04,2,"","RIO PIEDRAS","SAN GERARDO HOSP",PR,40,001,"PMB 250 WINSTON CHURCHIL AVE 138",926,72,127,"",405022
01,04,0,"",PONCE,"DAMAS HOSPITAL SNF",PR,40,001,"2213 PONCE BY PASS",717,72,113,"",405023
01,04,0,"",MANATI,"MANATI AREA HOSP DR OTERO LOPEZ",PR,40,001,"APARTADO 1142",701,"","","",405024
01,04,0,"","VEGA BAJA","CENTRO MEDICO WILMA N VAZQUEZ SNF",PR,40,001,"ROAD 2 KM 39 5 BO ALGARROBO",693,72,145,"",405025
01,04,0,"",SANTURCE,"MIMIYA HOSP",PR,40,001,"DE DIEGO AVE 303",940,72,127,"",405026
01,04,0,"","HATO REY","AUXILIO MUTUO",PR,40,001,"PO BOX 191227",919,72,127,"",405027
01,04,0,"","RIO PIEDRAS","THE MILLENNIUM INSTITUTE FOR ADVANCE NURSING CARE",PR,40,001,"CALLE COSME REPARTO SAN LUCAS SECTOR CANEJAS",926,72,127,"",405028
01,04,0,"",HORMIGUEROS,"SERVICIOS INTEGRADOS DE REHABILITACION (SIRO) INC",PR,40,001,"CALLE 4-L-10 URB COLINAS DEL OESTE",660,72,067,"",405029
01,04,0,"","RIO PIEDRAS","MILLENNIUM INSTITUTE FOR ADVANCE NURSING CARE INC",PR,40,001,"CALLE COSME REPARTO SAN LUCAS ENTRADA SECTOR CANEJ",926,72,127,"",405030
01,08,0,"","HATO REY","SOCIEDAD DE EDUCATION Y REH DE PR, INC",PR,40,001,"CALLE BAEZ 500, URB PEREZ MORRIS",917,72,127,"",406501
01,08,0,"","SAN SEBASTIAN","CENTRO DE MEDICINA Y CIRUGIA AMBULATOR",PR,40,001,"NO 3 JOSE MEDEZ CARDONA ST",685,72,131,"",406503
01,08,0,"",BAYAMON,"OPPT PHYSIOTHERAPY REHABILITATION CENTER",PR,40,001,"30 ST #UU 43 SANTA JUANITA",957,72,021,"",406504
01,08,0,"",HORMIGUEROS,"SERVICIOS INTEGRADOS DE REHAB DEL OESTE",PR,40,001,"CALLE 4 L 10, COLINAS DEL OESTE",660,72,067,"",406505
01,08,0,"",ADJUNTAS,"CENTRO TERAPIA FISICA ADJUNTENO",PR,40,001,"RIUS REVERA ST #16",601,72,001,"",406507
01,05,0,"","HATO REY","ASSOCIACION DE ENFERMERIA VISI",PR,40,001,"114 ELEANOR ROOSEVELT AVE 2 FLOOR",918,72,127,"",407001
01,05,0,"",PONCE,"SAINT LUKES HCP",PR,40,001,"P O BOX 7064",731,72,113,"",407002
01,05,0,"",PONCE,"HOSPITAL METROPOLITANO  DR PILA HOME CARE",PR,40,001,"7218 CALLE RAMON POWER",717,72,113,"",407003
01,05,0,"","RIO PIEDRAS","COMPLEJO MEDICO SOCIAL",PR,40,001,"AVE 65 INFANTERIA KM 3  5 BO  SABANA LLANA",926,72,127,"",407004
01,05,0,"",HUMACAO,"RYDER HOMECARE PROGRAM",PR,40,001,"355 FONT MARTELO AVE",791,72,069,"",407005
01,05,0,"",CAGUAS,"SERVICIOS DE SALUD EN EL HOGAR MENONITA",PR,40,001,"BO BAIROA  CARR 1  KM 34 9",725,72,025,"",407007
01,05,0,"",BARRANQUITAS,"SALUD INTEGRAL EN LA MONTANA INC",PR,40,001,"CALLE BARCELO 53 CARR 156 KM 16  3",794,72,019,"",407008
01,05,1,20040701,"HATO REY","CUIDADO CASERO HATO REY INC",PR,40,001,"AVE DE DIEGO 580 BAJOS PUERTO NUEVO",919,72,127,"",407009
01,05,0,"",PONCE,"VISITING HEALTH SERVICES PROGRAM HOSPITAL DAMAS",PR,40,001,"CALLE MONTERREY 286",717,72,113,"",407010
01,05,0,"","HATO REY","CONDADO HOME CARE PROGRAM INC",PR,40,001,"FLORAL PARK ST DUARTE 186",917,72,127,"",407011
01,05,0,"","PUERTO REAL","EL NAZARENO HOME CARE  INC",PR,40,001,"CARR  195 KM 1 5  SECTOR BELTRAN PUERTO REAL",740,72,053,"",407012
01,05,0,"",GUAYNABO,"CUIDADO CASERO GUAYNABO",PR,40,001,"CALLE UNION #5  ALTOS SECTOR PIEDRAS BLANCAS",970,72,061,"",407013
01,05,0,"",MANATI,"CORPORACION DE LAS VEGAS, INC",PR,40,001,"CARR 2 KM 46 4  EDIF LAS VEGA 420 BO CAMPO ALEGRE",674,72,091,"",407014
01,05,0,"",VIEQUES,"SERV DE SALUD EN EL HOGAR ISLA NENA",PR,40,001,"LUIS M RIVERA ST 117",765,72,147,"",407015
01,05,0,"",ARECIBO,"SERVICIOS DE SALUD EN EL HOGAR ARECIBO",PR,40,001,"CALLE GONZALEZ MARIN 11B",612,72,013,"",407016
01,05,0,"",HUMACAO,"METRO PAVIA AT HOME  HUMACAO",PR,40,001,"CARR 924 KM 1 7 BO COLLORES SECTOR PITAHAYA",791,72,069,"",407017
01,05,0,"",MAYAGUEZ,"CONVALESCENT HOME CARE INC",PR,40,001,"COND GUANAJIBO NUM A3 CAR 102",708,"","","",407018
01,05,0,"",CEIBA,"AMERICARE HOMEHEALTH SERVICES",PR,40,001,"AVE LAURO PINERO # 110",735,72,037,"",407019
01,05,0,"",MAYAGUEZ,"FIRST HOME CARE CENTER INC.",PR,40,001,"CALLE MCKINLEY  OESTE 96",680,72,097,"",407020
01,05,0,"","RIO PIEDRAS","SALUD FAMILIAR EN EL HOGAR, INC",PR,40,001,"SAN JACINTO #1385 URB ALTAMESA",921,72,127,"",407021
01,05,0,"","ALT DE ALGARROBO","LA ESPANOLA HOME HEALTH AGENCY",PR,40,001,"BOLA QUINTA CARR106",680,72,097,"",407022
01,05,0,"",ARECIBO,"ARECIBO MEDICAL HOME CARE INC",PR,40,001,"RODRIGUEZ IRIZARRY ST NO 163",612,72,013,"",407023
01,05,0,"",ADJUNTAS,"METRO PAVIA AT HOME ADJUNTAS",PR,40,001,"RODULFO GONZALEZ STREET #66",601,72,001,"",407024
01,05,0,"","HATO REY","SALUD FAMILIAR EN EL HOGAR",PR,40,001,"536 CALLE  CABO H ALVERIO",918,72,127,"",407025
01,05,0,"",VIEQUES,"SALUD EN EL HOGAR DEL CARIBE INC",PR,40,001,"CALLE BENITEZ CASTA?O #20",765,72,147,"",407026
01,05,0,"",ARECIBO,"ARECIBO MEDICAL HCP INC",PR,40,001,"URB GARCIA CALLE MORELL CAMPOS #57",612,72,013,"",407027
01,05,0,"",COROZAL,"PROGRAMA DE SERVICIOS DE SALUD EN EL HOGAR GEMINIS",PR,40,001,"CARR 159 KM 13 4 URB LOMA LINDA",783,72,047,"",407028
01,05,0,"",ARECIBO,"SALUD EN EL HOGAR DEL NORTE",PR,40,001,"BO HATO ABAJO SECTOR BARRANCA CARR 653 KM 2",612,72,013,"",407029
01,05,0,"","ALT DE LUCHETTI","LUZ DE ESPERANZA HOME CARE INC",PR,40,001,"CARR 668 BDA  FELIX CORDOVA DAVILA 126",674,72,091,"",407030
01,05,0,"",ISABELA,"HOME CARE FRANCISCOS",PR,40,001,"CARRETERA 2 KM 108 9 BO COTO STE 1",662,72,071,"",407031
01,05,1,20080101,GUAYNABO,"ESTANCIA HOME CARE INC, AN AMEDISYS COMPANY",PR,40,001,"7 CALLE 1 SUITE 303",968,72,127,"",407032
01,05,0,"","JUANA DIAZ","ANGELES VISITANTES, INC",PR,40,001,"29 CALLE TOMAS CARRION MADURO SUITE 1",795,72,075,"",407033
01,05,0,"",QUEBRADILLAS,"ANGELES DIVINOS HOME CARE SERVICES, INC",PR,40,001,"6374 CARRETERA ESTATAL 2 SUITE 1",678,72,115,"",407034
01,05,0,"",BAYAMON,"NUEVA VIDA DE LA SALUD HOME CARE CORP",PR,40,001,"PLAZA BAYAMON CARR 2 KM 15 5 SUITE HATO TEJAS",959,72,021,"",407035
01,05,0,"","COTO LAUREL","CMS HOME CARE SUR LLC",PR,40,001,"2004 CARR 506 COTO LAUREL",780,72,113,"",407036
01,05,0,"","BO PALMAS","ADVANCED HOME CARE SERVICE WEST INC",PR,40,001,"CARR 869 URB PALMAS INDUSTRIAL PARK CALLE 19  BO P",962,72,033,"",407037
01,05,0,"",GUAYNABO,"CMS HOME CARE METRO LLC",PR,40,001,"EDIFICIO 7 CALLE 1",968,72,127,"",407048
01,05,0,"",MAYAGUEZ,"CMS HOME CARE OESTE LLC",PR,40,001,"CARR 2 KM 156 5 SUITE 205 EDIFICIO OFFICE PARK",680,72,097,"",407049
01,05,0,"","SABANA GRANDE","HOME HEALTH LA MONSERRATE INC",PR,40,001,"AVENIDA 5 DE DICIEMBRE NUM 100",637,72,121,"",407050
01,05,0,"",COAMO,"ST LUKES HCP",PR,40,001,"14 QUIMON ST  132",769,72,043,"",407301
01,05,0,"",YAUCO,"ST LUKES HCP",PR,40,001,"EDIF PROFESIONAL YAUCO PLAZA OFFICE 55 56 66",698,72,153,"",407302
01,05,0,"",GUAYAMA,"ST LUKES HCP",PR,40,001,"DERKER ST 66 OESTE ESQ MC ARTHUR",784,72,057,"",407303
01,05,0,"",SALINAS,"ST LUKES HCP",PR,40,001,"17 LUIS MUNOS RIVERA ST BAJOS",751,72,123,"",407304
01,05,0,"","JUANA DIAZ","ST LUKES HCP",PR,40,001,"CALLE TOMAS CARRION MADURO ESQ  CALLEJON LAS MARIA",795,72,075,"",407305
01,05,0,"",LARES,"ST LUKES HCP",PR,40,001,"CARR 1111 AVE LOS PATRIOTAS APARTADO 1477",669,72,081,"",407306
01,05,0,"",AIBONITO,"ST LUKES HCP",PR,40,001,"CALLE SAN JOSE 300 ESTE APTO 1",705,72,009,"",407307
01,05,0,"",BAYAMON,"SAINT LUKE'S EPISCOPAL HOME CARE PROGRAM",PR,40,001,"CARRETERA 167 KM 19  5",958,72,021,"",407308
01,05,0,"",ARECIBO,"ST LUKES HCP",PR,40,001,"EDIF CARIBBEAN CINEMAS OFIC 203",613,72,013,"",407309
01,05,0,"","TRUJILLO ALTO","ST LUKES HCP",PR,40,001,"PO BOX 912 SAINT JUST STATION WESTERN AUTO PLAZA",978,72,139,"",407310
01,05,0,"",CAGUAS,"ST LUKES HCP",PR,40,001,"2 PADIAL ST APTO 8156",726,72,025,"",407311
01,05,0,"","ALTS DE YAUCO","HOSPITAL DR PILA HHA",PR,40,001,"55 COMERIO ST",698,72,153,"",407312
01,05,0,"",AGUADILLA,"ST LUKES HCP",PR,40,001,"AVE KENNEDY APTO 15 VICTORIA STATION",605,72,005,"",407313
01,05,1,20040701,MAYAGUEZ,"METRO PAVIA AT HOME MAYAGUEZ",PR,40,001,"740 HOSTOS AVENUE, MEDICAL CENTER PLAZA OFFICE 310",682,72,097,"",407314
01,05,0,"",CAYEY,"ST LUKES HCP",PR,40,001,"BARBOSA ST #59",737,72,035,"",407317
01,05,0,"",MAYAGUEZ,"ST LUKES HCP",PR,40,001,"198 MENDEZ VIGO",680,72,097,"",407320
01,05,0,"","SAN GERMAN","ST LUKES HCP",PR,40,001,"25 LUNA ST",683,72,125,"",407321
01,05,0,"",FAJARDO,"ST LUKES HCP",PR,40,001,"250 MU?OZ RIVERA ST",738,72,053,"",407322
01,05,0,"",UTUADO,"ST LUKES HCP",PR,40,001,"79 DR CUETO ST",641,72,141,"",407323
01,05,0,"","SAN SEBASTIAN","ST LUKES HCP",PR,40,001,"240 RUIZ BELVIS ST",685,72,131,"",407324
01,05,0,"",FAJARDO,"EL NAZARENO HCP",PR,40,001,"PARC BELTRAN ROAD 195  KM 1  5",738,72,053,"",407325
01,05,0,"",CAROLINA,"ASSOC VIS NURSE (GREGORIA AUF)",PR,40,001,"784 CAMPO RICO AVE URB COUNTRY CLUB",984,72,031,"",407326
01,05,0,"",BAYAMON,"ASSOC VIS NURSE (GREGORIA AU)",PR,40,001,"H 121 ATENAS STREET FOREST HILLS",959,72,021,"",407327
01,05,0,"","RIO PIEDRAS","CONVALESCENT HOME CARE RIO PIEDRAS",PR,40,001,"478 RIO PIEDRAS",918,72,127,"",407328
01,05,0,"",FAJARDO,"SERVICIOS TERAPEUTICOS EN EL HOGAR",PR,40,001,"CELIS AGUILERA 205",648,"","","",407329
20,01,3,"","HATO REY","AUXILIO MUTUO HOSP TRANSPLANT",PR,40,001,"PONCE DE LEON AVE, STOP 375",917,72,127,"",409800
01,15,0,"",MAYAGUEZ,"CLINICA DE CIRUGIA AMBULATORIA DR LUIS A VAZQUEZ",PR,40,001,"CALLE PERAL ESQ DE DIEGO 17 6TO PISO",680,72,097,"",40C0001000
01,15,0,"","SAN JUAN","SAN JUAN HEALTH CENTRE",PR,40,001,"152 AVE DE DIEGO PO BOX 41178",940,72,127,"",40C0001001
01,15,0,"",MAYAGUEZ,"INST DE CIRUGIA PLASTICA DEL O",PR,40,001,"165 MENDEZ VIGO ST",680,72,097,"",40C0001002
01,15,0,"",ARECIBO,"ARECIBO MEDICAL CENTER ASC",PR,40,001,"RT 2 KM 80 1 HATO ABAJO",613,72,013,"",40C0001003
01,15,1,"","SAN JUAN","EYE SURGERY SPECIALIST PR LLC",PR,40,001,"809 HIPODROMO ST PDA 20 SANTURCE",909,72,127,"",40C0001004
01,15,0,"","SAN SEBASTIAN","CENTRO DE DIAG Y TRAT Y CIRUGI",PR,40,001,"3 JOSE MENDEZ CARDONA ST",685,72,131,"",40C0001006
01,15,0,"",PONCE,"DR MORALES AMBULATORY SURGICAL CENTER",PR,40,001,"CONCORDIA ESQ POWER ST FULLANA BLD 8B",731,72,113,"",40C0001007
01,15,0,"",PONCE,"SOUTHERN SURGICENTER CORP",PR,40,001,"EDIFICIO PARRA  SUITE 201 PONCE BY PASS",717,72,113,"",40C0001008
01,15,1,20090406,"HATO REY","LAS AMERICAS AMBULATORY SURGIC",PR,40,001,"BOX 4236",919,72,127,"",40C0001009
01,15,0,"","HATO REY","INSTITUTO DE GASTROENTEROLOGIA DE PUERTO RICO",PR,40,001,"CLINICA LAS AMERICAS SUTIE 206",919,72,127,"",40C0001011
01,15,0,"",CAROLINA,"INSTITUTO OJOS Y PIEL ASC",PR,40,001,"CARRETERA 3 KM #23",985,72,031,"",40C0001012
01,15,0,"",AGUADILLA,"AGUADILLA MEDICAL SERVICES INC",PR,40,001,"PO BOX 250479",604,72,005,"",40C0001013
01,15,0,"","SAN SEBASTIAN","CENTRO DE CIRUGIA AMB DE SAN SEBASTIAN",PR,40,001,"CALLE JOSE MENDEZ CARDONA #3",685,72,131,"",40C0001014
01,15,0,"",CAGUAS,"ASC CLINICA DEL TURABO",PR,40,001,"MUNOZ RIVERA A-1",725,72,025,"",40C0001015
01,15,0,"",BAYAMON,"ASC Y LASER MEDICO",PR,40,001,"MEDICAL OPTHALMIC PLAZA SUITE 303 1875 ST 2",959,72,021,"",40C0001016
01,15,0,"","VEGA ALTA","NORTHEAST CORPORATION",PR,40,001,"EDIF CARIBE MEDICAL PLAZA SUITE 304",692,72,143,"",40C0001017
01,15,0,"",FAJARDO,"CARRIBEAN MEDICAL CENTER ASC",PR,40,001,"151 OSVALDO MOLINA AVENUE",738,72,053,"",40C0001018
01,15,0,"",PONCE,"CARIBBEAN SURGERY CENTER",PR,40,001,"8024 CONCORDIA SANTA MARIA SUITE 100",717,72,113,"",40C0001019
01,15,0,"",PONCE,"CONSEJO DE SALUD DE PUERTO RICO INC",PR,40,001,"1034 HOSTO AVE",716,72,113,"",40C0001020
01,15,0,"","ALT DE LUCHETTI","PROFESIONAL HOSPITAL INC, (CLINICA CRISTO REY)",PR,40,001,"ROAD 2 NO 46",674,72,091,"",40C0001021
01,15,0,"","SAN JUAN","DE DIEGO AMBULATORY CLINIC CORP",PR,40,001,"DE DIEGO AVE 150 COND SAN JUAN HEALTH CENTRE",907,72,127,"",40C0001022
01,15,0,"","ALTS DEL PRADO","CENTRO QUIRURGICO DE LA MONTANA",PR,40,001,"CALLE LUIS BARRERAS NUM 174",736,72,035,"",40C0001023
01,15,0,"","ALT DE ALGARROBO","CIRUGIA AMBULATORIA HOSPITAL SAN ANTONIO",PR,40,001,"CALLE POST 18 NORTE",680,72,097,"",40C0001024
01,15,0,"","BDA BITUMUL","CENTRO DE CIRUGIA AMBULATORIA DE PROCEDIMIENTOS U",PR,40,001,"AVENIDA PONCE DE LEON 735 PDA 37 1 2",917,72,127,"",40C0001025
01,15,0,"","ALT DE SAN PATRICIO","GUAYNABO AMBULATORY SURGICAL GROUP INC",PR,40,001,"CITY VIEW PLAZA TORRE II CARR 165 KM 1 2 NUM 48",968,72,127,"",40C0001026
01,15,0,"","ALT DE JUNCOS","CENTRO OFTALMOLOGICO DE ARECIBO",PR,40,001,"404 DE DIEGO",612,72,013,"",40C0001027
01,15,0,"","HATO REY","CENTRO DE CIRUGIA AMBULATORIA LAS AMERICA",PR,40,001,"400 FD ROOSEVELT AVE EDIF CLINICA LAS AMERICA  301",918,72,127,"",40C0001028
01,15,0,"",BAYAMON,"ADVANCE PAIN MANAGEMENT AND REHABILITATION INSTITU",PR,40,001,"URB SANTA CRUZ E22 CALLE SANTA CRUZ",961,72,021,"",40C0001030
01,15,0,"",PONCE,"ADVANCED ENDOSCOPY CENTER",PR,40,001,"2213 PONCE BY PASS SECOND FLOOR",717,72,113,"",40C0001031
01,15,0,"",BAYAMON,"CENTRO DE CIRUGIA UROLOGICA AMBULATORIA",PR,40,001,"68 CALLE SANTA CRUZ TORRE SAN PABLO SUITE 102",961,72,021,"",40C0001032
